{
  "registry_version": "1.0.0",
  "source_commit": "90ad40cf059f300f23fd874353767e1d19ccb815",
  "source_ids": [
    "P01", "P02", "P03", "P04", "P05", "P06", "P07", "P08", "P09", "P10",
    "P11", "P12", "P13", "P14", "P15", "P16", "P17", "P18", "P19", "P20",
    "P21", "P22", "P23", "P24", "P25", "P26", "P27", "P28", "P29", "P30",
    "P31", "P32", "P33", "P34", "P35", "P36", "P37", "P38", "P39", "P40",
    "P41", "P42", "P43", "P44", "P45", "P46", "P47", "P48", "P49", "P50",
    "P51", "P52", "P53", "P54", "D01", "D02"
  ],
  "principles": [
    {
      "principle_id": "effect-claims-require-direct-measurement",
      "summary": "GEO drafting and readiness outputs do not establish citation, ranking, traffic, conversion, or revenue effects.",
      "surfaces": ["all"],
      "source_ids": ["P13", "P18", "P25", "P42", "P54", "D01", "D02"],
      "claim_classes": ["benchmark", "governance", "null-result", "observational-correlation"],
      "causal_status": "mixed",
      "platform_scope": ["study-specific engines", "offline benchmarks", "static platform snapshots"],
      "proxy_variables": ["influence_score", "readiness_score", "visibility_score"],
      "allowed_use": "guardrail",
      "required_controls": ["label proxies", "preserve null results", "prohibit effect guarantees"],
      "limitations": ["No reviewed source establishes a universal live-platform effect."]
    },
    {
      "principle_id": "query-diversity-is-conditional",
      "summary": "Query and intent diversity can improve coverage in selected agentic benchmarks and should remain a testable planning hypothesis.",
      "surfaces": ["geo-discover", "geo-measure"],
      "source_ids": ["P03", "P07", "P08", "P14", "P21", "P23", "P47", "P48", "P49"],
      "claim_classes": ["benchmark", "mechanism", "null-result", "observational-correlation"],
      "causal_status": "benchmark-conditional",
      "platform_scope": ["agentic search benchmarks", "selected generative engines", "query-specific observations"],
      "proxy_variables": ["query coverage", "retrieval recall"],
      "allowed_use": "planning-hypothesis",
      "required_controls": ["deduplicate variants", "record locale and audience", "retain parent query lineage"],
      "limitations": ["Benefits vary by model capability, query wording, engine, and measurement time."]
    },
    {
      "principle_id": "diagnosis-scores-are-readiness-proxies",
      "summary": "Structural, brand, semantic, and source signals may support remediation planning but remain observational or benchmark proxies.",
      "surfaces": ["geo-diagnose"],
      "source_ids": ["P12", "P16", "P18", "P19", "P22", "P45", "D01"],
      "claim_classes": ["benchmark", "mechanism", "observational-correlation", "null-result"],
      "causal_status": "observational",
      "platform_scope": ["three-engine B2B audit", "cross-platform citation snapshot", "offline search arena"],
      "proxy_variables": ["influence_score", "answer-readiness heuristic", "GEO-16 audit score"],
      "allowed_use": "planning-hypothesis",
      "required_controls": ["separate observed and inferred findings", "show source gaps", "do not predict citation probability"],
      "limitations": ["Proxy components and proxy totals are mechanically related and cannot serve as independent causal evidence."]
    },
    {
      "principle_id": "semantic-relevance-precedes-format-tactics",
      "summary": "Semantic relevance and evidence fidelity have stronger support than broad formatting recipes.",
      "surfaces": ["geo-content", "geo-content:title", "geo-content:explainer", "geo-content:refine"],
      "source_ids": ["P01", "P05", "P06", "P07", "P09", "P10", "P16", "P25", "P45"],
      "claim_classes": ["benchmark", "mechanism", "observational-correlation"],
      "causal_status": "mixed",
      "platform_scope": ["GEO benchmarks", "controlled RAG", "cross-platform observations"],
      "proxy_variables": ["semantic relevance", "visibility metric", "faithful credit"],
      "allowed_use": "planning-hypothesis",
      "required_controls": ["preserve source meaning", "link factual claims to evidence", "treat format as a hypothesis"],
      "limitations": ["Benchmark gains and observational associations do not establish a general live citation lift."]
    },
    {
      "principle_id": "comparison-requires-governed-evidence",
      "summary": "Comparison output needs like-for-like criteria, explicit evidence, conflict handling, and no unsupported winner.",
      "surfaces": ["geo-content:comparison"],
      "source_ids": ["P13", "P25", "P42"],
      "claim_classes": ["benchmark", "governance", "null-result"],
      "causal_status": "governance",
      "platform_scope": ["comparison governance", "conflicting-evidence benchmark", "competitive benchmark"],
      "proxy_variables": [],
      "allowed_use": "governance-control",
      "required_controls": ["complete entity-by-criterion matrix", "preserve conflicts", "block unsupported verdicts"],
      "limitations": ["The reviewed sources do not establish an effectiveness estimate for the comparison mode."]
    },
    {
      "principle_id": "ranking-content-needs-manipulation-controls",
      "summary": "Ranking content is exposed to manipulation, poisoning, and competitive adoption risks.",
      "surfaces": ["geo-content:ranking", "geo-content:refine", "knowledge"],
      "source_ids": ["P31", "P33", "P34", "P35", "P36", "P37", "P38", "P39", "P40", "P43"],
      "claim_classes": ["benchmark", "governance", "mechanism", "null-result"],
      "causal_status": "benchmark-conditional",
      "platform_scope": ["adversarial retrieval benchmarks", "RAG systems", "selected online probes"],
      "proxy_variables": ["attack success rate", "retrieval rank"],
      "allowed_use": "governance-control",
      "required_controls": ["declare evaluation method", "reject prompt injection", "record competition and threat model"],
      "limitations": ["Attack findings cannot be converted into normal optimization guidance."]
    },
    {
      "principle_id": "structure-edits-must-be-reversible",
      "summary": "Structural changes can help selected benchmarks and can also degrade retrieval or citation outcomes.",
      "surfaces": ["geo-content:page-blueprint", "geo-content:refine", "geo-diagnose"],
      "source_ids": ["P09", "P11", "P13", "P18", "P19", "P41", "P42"],
      "claim_classes": ["benchmark", "mechanism", "null-result"],
      "causal_status": "benchmark-conditional",
      "platform_scope": ["retrieval benchmarks", "search arena", "multimodal benchmark"],
      "proxy_variables": ["retrieval rank", "citation visibility", "structure score"],
      "allowed_use": "planning-hypothesis",
      "required_controls": ["preserve semantics", "record before and after", "support rollback", "report degradation"],
      "limitations": ["Structure effects are model-, corpus-, and task-dependent."]
    },
    {
      "principle_id": "measurement-requires-distributions-and-denominators",
      "summary": "Measurement requires repeated trials, fixed denominators, missing-answer accounting, platform scope, timestamps, and uncertainty intervals.",
      "surfaces": ["geo-measure", "strategy"],
      "source_ids": ["P12", "P14", "P15", "P17", "P21", "P22", "P23", "P44", "P53", "P54", "D01", "D02"],
      "claim_classes": ["causal", "benchmark", "governance", "null-result", "observational-correlation"],
      "causal_status": "mixed",
      "platform_scope": ["repeated live-engine observations", "product experiments", "static datasets"],
      "proxy_variables": ["visibility", "citation rate", "influence_score", "answer availability"],
      "allowed_use": "measurement-design",
      "required_controls": ["record eligible and answered trials", "record numerator and denominator", "record missing reasons", "report interval method", "label intervention status"],
      "limitations": ["Engine, interface, model, geography, language, and time can change the observed distribution."]
    },
    {
      "principle_id": "knowledge-needs-provenance-and-conflict-controls",
      "summary": "Knowledge operations require source lineage, rights, freshness, conflict records, and poisoning controls.",
      "surfaces": ["knowledge", "geo-content", "geo-diagnose"],
      "source_ids": ["P02", "P04", "P20", "P24", "P25", "P32", "P34", "P36", "P37", "P46", "P50", "P51", "P52", "P54"],
      "claim_classes": ["benchmark", "governance", "mechanism"],
      "causal_status": "governance",
      "platform_scope": ["RAG benchmarks", "digital repositories", "policy-governed production systems"],
      "proxy_variables": ["retrieval recall", "judge score"],
      "allowed_use": "governance-control",
      "required_controls": ["record provenance", "record rights and freshness", "preserve conflicts", "scan for poisoning"],
      "limitations": ["Private labels and production systems are not independently reproducible."]
    },
    {
      "principle_id": "seo-and-geo-share-an-upstream-retrieval-boundary",
      "summary": "Traditional retrieval remains upstream while offline query variants remain a bounded Discover planning capability.",
      "surfaces": ["geo", "geo-discover", "SEO-GEO-boundary"],
      "source_ids": ["P11", "P13", "P18", "P21", "P23", "P26", "P27", "P28", "P29", "P30", "P34", "P40"],
      "claim_classes": ["benchmark", "governance", "mechanism", "observational-correlation"],
      "causal_status": "mixed",
      "platform_scope": ["traditional retrieval", "generative search", "conceptual marketing frameworks"],
      "proxy_variables": ["SERP rank", "retrieval rank"],
      "allowed_use": "boundary-only",
      "required_controls": ["exclude search-volume claims", "exclude keyword-difficulty claims", "exclude traffic attribution", "retain offline query variants"],
      "limitations": ["Citation presence cannot be converted into conventional ranking or commercial traffic effects."]
    },
    {